evidence_id,medication_id,medication_raw,medication_normalized,normalization_id,disease_scope,claim,evidence_type,source_title,source_id,source_url,quoted_evidence,retrieval_date,status,limitation,needs_human_review
DRUG001,MED001,Phenytoin,Phenytoin,UNII:6158TKW0C5,generalized_seizure,The opened DILANTIN label supports treatment of tonic-clonic seizures.,drug_label,DILANTIN (extended phenytoin sodium capsules) prescribing information,DailyMed Set ID 8848de76-8d74-4620-bcc7-a86a596e5dd9,https://dailymed.nlm.nih.gov/dailymed/drugInfo.cfm?setid=8848de76-8d74-4620-bcc7-a86a596e5dd9,DILANTIN is indicated for the treatment of tonic-clonic (grand mal) ... seizures.,2026-07-12,supported,Product label evidence does not establish an ICD subtype or patient-specific indication.,FALSE
DRUG002,MED001,Phenytoin,Phenytoin,UNII:6158TKW0C5,focal_seizure,The opened DILANTIN label supports treatment of psychomotor (temporal lobe) seizures.,drug_label,DILANTIN (extended phenytoin sodium capsules) prescribing information,DailyMed Set ID 8848de76-8d74-4620-bcc7-a86a596e5dd9,https://dailymed.nlm.nih.gov/dailymed/drugInfo.cfm?setid=8848de76-8d74-4620-bcc7-a86a596e5dd9,DILANTIN is indicated for the treatment of ... psychomotor (temporal lobe) seizures.,2026-07-12,supported,Older label terminology is preserved; it is not used to choose an ICD candidate.,TRUE
DRUG003,MED002,Carbamazepine,Carbamazepine,UNII:33CM23913M,focal_seizure,The opened TEGRETOL label supports partial seizures with complex symptomatology.,drug_label,TEGRETOL / TEGRETOL-XR prescribing information,DailyMed Set ID 8d409411-aa9f-4f3a-a52c-fbcb0c3ec053,https://dailymed.nlm.nih.gov/dailymed/drugInfo.cfm?setid=8d409411-aa9f-4f3a-a52c-fbcb0c3ec053,"Partial seizures with complex symptomatology (psychomotor, temporal lobe).",2026-07-12,supported,"Label supports a seizure category, not a specific ICD code assignment.",FALSE
DRUG004,MED002,Carbamazepine,Carbamazepine,UNII:33CM23913M,generalized_seizure,The opened TEGRETOL label supports generalized tonic-clonic seizures.,drug_label,TEGRETOL / TEGRETOL-XR prescribing information,DailyMed Set ID 8d409411-aa9f-4f3a-a52c-fbcb0c3ec053,https://dailymed.nlm.nih.gov/dailymed/drugInfo.cfm?setid=8d409411-aa9f-4f3a-a52c-fbcb0c3ec053,Generalized tonic-clonic seizures (grand mal).,2026-07-12,supported,The same label notes mixed patterns and non-epilepsy use; no patient inference is allowed.,TRUE
DRUG005,MED003,Valproic acid,Valproic acid,UNII:614OI1Z5WI,broad_epilepsy,Current MedlinePlus information supports valproic acid for certain seizure types without naming an ICD subtype.,other_verified_source,Valproic Acid: MedlinePlus Drug Information,MedlinePlus a682412,https://medlineplus.gov/druginfo/meds/a682412.html,Valproic acid is used to treat certain types of seizures.,2026-07-12,supported,The opened source does not specify which seizure subtypes in this sentence; classify only as broad epilepsy.,TRUE
